id,address,rating,good_one,good_two,good_three,bad_one,bad_two,bad_three,size,groupid
Cici's Pizza 3,5035 W Irlo Bronson Memorial Hwy,3.0,"Walking in we were greeted with a friendly smile and a boisterous ""welcome to Cici's!"" We were able to get our local residents discount and we were quickly on our way to hot fresh delicious pizza on the buffet. 

The special limited pizza they are offering right now is the Bacon Cheddar Pizza that I have been anxiously waiting to try, because it has two of my most favorite things. Cheese and bacon. Well I was not disappointed. It was hot and ready and plentiful. Never once was the try on the buffet empty. As far as the taste of the pizza went, it was just as I expected. No pizza sauce to get in the way, just bacon and cheesy goodness. 

The best part is that I had my favorite alfredo pasta to go along with it. I was a little nervous with it being a Holiday that this place would be crazy and they would have trouble keeping up with the flow of customers but they exceeded my expectations.

Bravo Cici's!","Great family restaurant! Prices are affordable, pizza was great and the salad bar had a good variety. The employees were also really friendly and the manager went out of his way to make our visit extra special. Would definitely eat here again if we are in the area!","Had a coupon for buy one adult pizza buffet get one free. Took our family of 7 after going to Disney. It was less than $40 for all of us, two being children. They had a great salad bar that had very fresh vegetables on it. The pizza was fresh and great. They kept it rolling out. The restaurant was very clean as well as the restrooms. The people working there were also very friendly. Just a great meal after spending tons of money all week on so so food.","Went to CiCi's 1st time ever! Get in your car turn around head down 2 blocks to the Golden Coral the Lunch price is the same! You can even get pizza there too. Salad bar is 10X way better,fresher and safer than CiCi's! I was hoping it would be decent Sorry it's NOT!","If you're hungry for Cici's, you know what you're in for, but trust me, hit a different location.  It's overpriced at $7.99 for the buffet and the guy running the place charges 50 cents for a to go cup on top of everything.  One person at Cici's should not cost $12.  That's just insane.  This particular Cici's is on 192 in a tourist trap.  The restaurant is in a plaza and is open into a gift shop, the kind that sells shirts for $5.  The other wall is a discount attractions ticket vendor.  Seriously.  As far as the food goes, perhaps the kitchen staff were being lazy because, despite three large families with kids in the restaurant, the pizza out was all dry.  When they DID eventually put out fresh food, it was sub par to other locations in the area.  Cici's is fine for what it is, but trust me, avoid this one.",It takes a lot of work to make pizza terrible.  This place did it.  The drink machines smelt like mildew and the ice in the drinks made my throat burn.  STAY AWAY!,56,1
Cici's Pizza 4,"13605 Sr 535, Ste 101",3.0,"New facility, well kept, pleasant atmosphere, always busy, surrounded by many resort hotel.","First of all staffs were super friendly and nice
And place was very clean and food was delicious . One of the best cici pizza franchise ive ever been.",I was so excited to finally eat at Cici's and it didn't disappoint. This is another cheap meal option during your Disney vacation. They have cheesy garlic bread pizza which I think is really amazingly delicious. Also the pasta salad was good too. I didn't notice until the last day of my vacation that on the back of the receipt there's a survey that can get you a $4 buffet.,"First, plates small cups, forks were not clean.... dirty..   restroom smell pretty bad... very skimpy toppings...  also pricy at $6.99 adult buffet + $1.99 drink.  More expensive than other cici's...  very less selection of pizzas.  Not recommended place.  You will agree with me.  Not fresh pizza at all.","Cafe's | Food Carts | Restaurants

Relatively Close To: Dollar Tree.

Public Transportation: No.

Valet Service: No.

Wheelchair Accessible: Yes.

Service Pet Allowed: Yes.

Parking: Shared parking lot.

Popularity: Yes, among Disney's College Program and vacationing families with budgets.

Reason of Visit: Stopped and had buffet with my lovely mother.

Cellular Reception: Yes.

Free Wifi: No.

Outdoor Space: No.

Cleanliness: It's descent. 

Lighting: Sufficient. 

Presentation: Doesn't apply.

Ownership: Unsure.

Items Ordered: Two buffets, included drinks..

Check-in Wait Time: Doesn't apply. 

Temperature: °80

Staffs knowledgement of business and or amenities: Unsure.

Overall Service: Check out was easy and quick.

Staffs response on compliments: I did not give one. 

Staffs response about complaints: The dishes (all of them) had a film of crust of food on them. The manager was there and I took two plates to him and showed him that a butter knife could scrape off all the nasty layered contaminates off the plates. He apologized and blamed the dish washer for not using some liquid that is supposed to wash the plates clean. I went back to see the plates and non were removed and still were contaminated. 

Recommendations:
Two ** stars or less dont consider.
Three *** stars be cautious.
Four **** stars or more highly recommended.

Quick Notes: Before you eat here, take a good look at the plates. If the color on the plates are not the same shade of yellow, you will know that the darker yellow is crusted on left-over food from other users. From that point on, you choose to eat of move on elsewhere. You can buy paper plates at the Dollar Tree nextdoor.

My reviews are structured and rated in many areas. I believe that my experiences will provide consumers satisfactory or acceptable in quality or quantity information.

I hope this particular review has helped you carefully decide whether or not to give this venue your business.

Pastor Leo
VenuLifeChurch.org",this is the worst cici i ever be the one star is for the cashier really nice and helpful but service is bad the manager i think she don't l8ke her job definitely i never come back again,35,1
Covington Mill Restaurant,1751 Hotel Plaza Blvd,4.0,"Great Lunch, great service, friendly and perfect service from our waitress, Erin! Perfect ""Create an Omelet"", $16. And, ""Chicken Tikka Masala"", $22. Don't let the casual atmosphere fool you, the food is delicious! We will return. Thank you.",We had breakfast here while staying at the Hilton. The pancakes were AMAZING! Eggs were delicious. No powdered eggs here! The second day I had French toast and was NOT disappointed! Sunday the Disney characters come around for hints and photo ops. Definitely recommend this restaurant  for breakfast.,Honestly the breakfast buffet was great! It's a big spread with everything you can think of. For the buffet as long as an adult gets the buffet a child gets buffet for free. Can beat it especially if you are staying in the Hilton,"We are staying at this Hilton hotel and came down for breakfast before we went out to the parks. I had an eggs Benedict and I had to ask for a steak knife to cut through the English muffin and even that felt like I was getting an arm workout. It said it came with asparagus and literally came with just one asparagus. The potatoes definitely came out of a bag. My husband had the egg breakfast with just scrambled eggs, toast, potatoes, and turkey sausage. He said the only very good thing on the plate was the turkey sausage. Everything else was average. The kid's plate was fine with a pancake that had Mickey print in the middle of it so my daughter liked that. I wouldn't have minded this so much except that when we got the bill it was $50 for a less than average breakfast. We should have gone to a diner and had way better food for less than 30 bucks. I have never written a two star review, but this one deserved it.",This is not a quaint local restaurant. It is in the Hilton. We were disappointed as we've been trying to stick to local owned places. Food was acceptable but definitely hotel restaurant prices.  Wasted one breakfast - after we drove here we stayed. Should have in description that it's in the hotel. We would have skipped it.,Not too impressed. Our waiter strongly persuaded us to take the buffet and then we were told they didn't do poached eggs except by service. Staff in general were mediocre.,18,1
Crazy Buffet 1,12237 Orange Blossom Trl,4.0,"The restaurant is very clean , food was hot and fresh. Gloves are provide when you are seated. And more available at the buffet. They are doing great job!","Excellent Chinese buffet, very clean very beautiful inside nice ambience. Friendly servers and staff, clean restrooms","I went yesterday with friends and I love the safety procedures. I feel save!! They gave you gloves to serve yourself. The food was fresh, yummy and very hot!! I love that!! The server was always asking us if we need something! Very clean place!",I think that it is a lack of respect to the client to place a limit of 6 oysters per person on a Saturday at dinner time. The person who opens the oysters is a rude disrespect they should improve the attention to customers.,"I was thinking when I went to this new restaurant that I must be crazy to be going to a buffet while COVID is on the rise.  I was their first customer on the day they opened.  I got there about 5 minutes before they were scheduled to start serving and for a long time I was the only customer.  So yes I was their first customer on day one.

They have different prices for lunch and dinner but since this was Sunday, it was dinner all day, which includes a seafood buffet that has salt and pepper crab legs.  They were really good.  It also features a pho bar where you can pick ingredients they will grill and you spoon broth on top of your selection after the chef has cooked them.  The broth had a spice that did not appeal to me.

They advertise 350 items and have a lot of the items you would expect to find on an Asian buffet.  During the pandemic they have foam plates and bowls and the utensils are sealed plastic ware similar to what is commonly provided with a to go meal.

Pros
  - they are giving everyone gloves and have hand sanitizer
  - fresh and flavorful food although I was there early and my opinion is based on a single visit
  - good sushi including sashimi and rather than having a lot they have selected rolls of high quality
  - service was attentive and my server shared her favorite and suggested items
  - something for everyone.  I also saw mac n cheese, pizza and baked sweet potatoes for kids
Cons
  - they did not seem to be social distancing the tables.  Even though the restaurant was nearly empty they sat a table right next to me.  When I spoke to the manager and mentioned my concern, he did not seem to understand my request.

I am not sure I will go back until the pandemic is over.  I noticed some people were not wearing the gloves and masks at the food bars and the staff were asking them to comply.","The restaurant is very clean , food was hot and fresh. Gloves are provide when you are seated. And more available at the buffet. They are doing great job!",6,1
Crazy Buffet 2,7038 W Colonial Dr,3.5,"This is my favorite Chinese buffet in town now. We were avid Garden Buffet fans until we found this place. We love the huge variety of items and the hibachi is so delicious. We haven't tried their pho yet, but it also looked great. Also the decor is beautiful which just adds another reason for 5 stars.","I love this place for lunch. Their food is delicious, always fresh when I have visited and this restaurant is always clean. The wait staff is very friendly. I look forward to eating here and I don't eat at many buffets. Crazy Good!",Omg...soooo good! The sushi was way better than I expected. The selection is massive. I will definitely come back!,"After reading all the great reviews, I decided to try it out. Went in at 7:45 pm and saw mostly emptied and dried out food. 

All the fish dishes were gone and never refilled. 

All the dim sum were gone. 

Not much selection of sushi and most were leftovers from earlier. The sushi chef just stood behind the counter just cleaning up and didn't make any new sushi. 

There were hardly anything to eat. I felt like why open till 10pm if at 7:45 pm most of the food is gone? 

Overall, there's nothing special about this place.","My wife and I where invited to join family at this restaurant. I had a taste for sushi. After eating about three pieces I became sick. I then went to the bathroom. To try and get myself together. It was filthy. So I went outside for air. I will never ever return. It has been more than 8 hours, and my stomach is still upset.","Hated it! You'd have to be CRAZY to think that anyone could like this place. Yuck. I give this a One Star review because Yelp won't let me leave NO Star reviews! Just bad. So much variety, so little quality. Nothing tastes good, even the desserts are crap. Just yuck. My tip? You'll have a better time paying someone to kick you in the balls while smacking your mother and stealing your identity. Save yourself the hassle and just starve.",247,1
Crydermans Barbecue,401 Florida Ave,4.5,I'm a self proclaimed bbq snob and this brisket is some of the best I've had. Ribs so tender you can't pick them up by the bone. So glad they opened for dinner. We will be back.,"By far the best BBQ I've had anywhere in the area. They created a plate for us so we could try everything. We had brisket, ribs, turkey and pulled pork, as well as the Mac and cheese and beans. Absolutely everything was super tender and ate it with a plastic fork. Best brisket I've had outside of Texas and would also get the pulled pork again (I normally say pulled pork is nothing special, but the seasoning on this was!). I'm not a big sauce person so the ribs weren't my favorite but my husband loved them. If in the area, this place is a MUST. But get there early... they close when they sell out!",Absolutely delicious and worth the wait in line! Authentic and tender fall off the bone BBQ ribs! The turkey was seasoned perfectly and juicy. First time there and will not be the last!,"I usually have ribs at any bbq joint. These were tender but had way too much black peppercorns. Indigestion city. The only thing I liked was the smoked turkey. The Mac and cheese had good flavor but they served me the oldest batch. The cheese was starting to curdle.

For $40 I don't think I'll be back. AND I don't mind paying the price for quality foodie food. But I felt ripped off. I could have gone to Sonnys BBQ and had good quality ribs for a fraction of the price. 

Brevard County Taste buds are weak. This is the last time I go by reviews around these parts.",Not a good choice for traditional smoked turkey. I am convinced they are using a precooked deli style turkey breast. No smoked flavor at all and dripping wet. Very disappointing. Than,"Worst smoked turkey I've ever had. It was wet like a precooked deli style cold cut turkey meat. No Smokey taste and it looked just like a PRE packaged precooked cold cut turkey meat. We, both my fiancé and I could not believe they could sell such an awful product. We are local and will never go back",119,1
Curry House Indian Cuisine,11352 S Orange Blossom Trl,4.5,Stopped by because we saw the special for the lunch buffet! I was surprised by the variety of food that was offered! The chicken tikka masala was amazing and flavorful. There was also unlimited butter naan for the buffet and I couldn't get enough of it. Service was great and staff was friendly! Would be stopping by again!,"Curry House was just what we were looking for! A great Indian buffet that had flavorful dishes with a large variety in the buffet. There were plenty of vegetarian dishes and many different types of meat options like chicken biriyani, goat curry, butter chicken, tandoori chicken, and even fish curry! The naan was fresh and paired perfectly with all the delicious curries. The desserts were also so tasty! Service was great and staff was friendly. Can't wait to come back for more. Definitely recommend this place!",Nice and clean place my husband had Chicken Madras and I had Vegetable Korma the food was great do was the service.,There use to be my favorite restaurant called king Kabab I miss that place I finally gave this place a try order 2 different kormas chicken and lamb both was with same color curry very disappointed and the mix grill wasn't worth the $18 unfortunately I won't be back ended up wasting a lot of food and spend $62 wasn't worth it at all bring #kingkabab back.,"11 stars for service (the 2 young wait staff) though the manager/owner was a little less friendly than these kids were. They were *awesome.*
The place, confirmed by the waitress, was very new. They're trying to figure out how to service and stay alive in these Covid times. We were itchin for Indian (we eat a lot of Indian) and had to have vegetarian options. The all-you-can-eat is great because we can try a lot of things. AYCE Thali? Other than in India, the only place I remember trying with this style was a Gujarati place in NYC (amaaaaazing). So we were excited. We asked about the buffet - nope (nowhere online did it say this). we asked about the AYCE Thali and were handed a separate menu with 2 options. Cool! We order one then are told that one is not available. ARGH - getting frustrated here. We order the other. They also have some Indo-Chinese stuff we like such as Manchurian. So, of course, we grabbed one of those. There was plenty of food on the Thali so we did not have to order a second time. The food was decent - hot, freshly made, and better than average. Would we go back? Sure, especially once the place is fully open. Again, terrific service from the 2 servers - both super super friendly and helpful.",Was looking for a quick bite to eat after a stop at Costco. Drove through this shopping center and found curry house. They seemed to just have opened. My bf and I decided to run in and check it out. They have a regular menu too but on weekends they have lunch buffet. The grand opening special is 10.99 per person. They have your basic typical Indian dishes. Curry and tikka masala. They had a fish curry which was really good. Most places I've been to doesn't seem to serve fish at all in their buffets. There are vegan options as well. They bring you out a basket of naan. Nice and hot. I had a plate and a half of food. There's dessert options and fruits. The service was friendly. The food was good. Not a bad deal!,16,1
El Palacio Buffet 1,909 West Vine St,4.0,"This place is delicious! 12.99 all you can eat OMG! Oxtails, puerro rican pasteles, all types of rice, meat plus empañadas de carne, queso etc. Salad, veggies fruit and ice cream. Still hungry? They have a Chinese food section too! Man I want to eat here everyday. Yum",Love the food here! Prices are great! People are so sweet this is a must come restaurant! The food is amazing Love the food here! Prices are great! People are so sweet this is a must come restaurant! The food is amazing,,"If you follow me at all you'll say what the hell is he doing there?   Stupid SOB.   LOL.   Well, the lot was packed Sunday at 3 pm so we decided to stop.   Ice cream was good.   Wings were ok.   I'm still here, no runs yet but I know where the bathroom is.","I was there 2 times. Food was great! But last week January 26, 2017 I decided to invite two friends to eat there. One day later we finished with food poison. We get so sick. Be careful!","No dan descuento a Seniors, Veteranos, a personas con la operation Bariatrica y no tienen precio de ninos. La comida no es tan Buena y no tienen sazon Boricua y segun el cajero/ ""Manager"" hoy que protesto porque lo creí  Boricua y resulto ser Dominicano. Por eso nos desacreditan! Como voy a creer que una gran mayoria de restaurantes Americanos, dan descuento de Senior, de Veteranos y por tener la operation Bariatrica y los restaurantes Latinos no quieren. Por eso no progresan.  El que diga Que esta Buena, no tienen familiares Que cocinen bueno o llevar mucho tempo fuera de la Isla. Aunque ya la comida en Puerto Rico, no esta tan Buena y es estilo Dominicano, además de cara. Tambien Los baños estan tan asquerosos como en Puerto Rico. Me imagine Que no Se La Van Las man Is. Los Dominicanos y los Cubanos, deberian estar en primera fila, para la deportacion.

El Melao tiene mejor precio y mejor sabor, apesar que tampoco consideran ningun descuento, ni militar, ni Senior, ni operacion bariatrica, ni nino, ni religioso, apesar de que son ""Religiosos"", pero lo que les importa es el dinero. A los militares les exijen tener Uniforme y les importa un pito el ID militar que es mas oficial, pues cualquiera se puede poner un uniforme. Nuestra eaza es nuestro peor enemigo, hasta en Puerto Rico.",41,1
El Palacio Buffet 2,7403 S Orange Blossom Trl,3.5,Wow. I am amazed of how good the food taste here. I went for all spañish food. Everything taste amazing.  It's cheap and servers are nice.,"My wife is New Yorican, and she loves the flavors of her native home (Puerto Rico), me, not to much. We stopped in on 3/5/2016 and I have to tell you we both was very happy. I can hardly wait until our next trip there. It was the best Latin food I have had in a restaurant. They also have a few Chinese dishes which I love also. Great job, you guys have it goin on.... Dan",EVRYTHING GREAT HIGHLY RECOMMEND. Price for dinner is 10 dollars drinks and everything included.,"I'm so sorry but how is this place even open for business? I'm really hoping that I went on an off day because the food was absolutely disgusting and everything tastes bitter and old. Usually I would give places another chance but this place has absolutely no chance for one. People seem to rave about how they offer both Spanish and Chinese food so that's why they give them good ratings but besides the food being appalling (couldn't finish anything), that is the exact reason I'm giving it 1 star. Too much stuff going on in terms of what to serve customers that the quality of the food fails horrible. Please if you are the owner and reading this. Focus in specializing in one type of food so that the quality becomes better. It's too all over the place. Until that happens, I will not be returning to this place anytime soon.",I have a few employees that used to eat there. Until my Admin said that she found a hair in her food and couldnt eat. SOOOOO lets just say i wont ever make it there. Im sure if people are saying they dont wear gloves they dont give a crap about a hair net.,Disgusting and dirty. I was so excited to try the Latin buffet... This place is 95% Chinese. Flys. Flys were everywhere. Sagging and stained ceiling panels. It's hot because the ac is not sufficient and the whole place is just dirty and sloppy.,157,1
