id,address,rating,good_one,good_two,good_three,bad_one,bad_two,bad_three,size,groupid
Moghul Indian Cuisine,401 N Semoran Blvd,4.0,"Moghul was amazing!  I have a small (okay huge) Indian food addiction, so I'm always looking for great places around Orlando.   Apparently, they have some of the most authentic Punjab-style food in town, and they didn't disappoint.  Their portions were huge, the menu was fairly priced, and service was fast.  I'm usually a chicken tikka masala or vindaloo person, but I heard their lamb dishes and traditional curry were especially good, so we ordered their lamb curry and vegetarian appetizer.  The sauce was everything a curry should be, and the lamb was cooked extremely well.  The best part of all though is that they will actually give you ""Indian hot"" if you ask for it when many restaurants do not.  I will definitely be going back.","SHUKRIA!

We were so excited when we found the Kohrinoor folks had opened a place closer.  Went there tonight and had vegetable samosas to start things off.  They were -- we think -- the BEST we've ever had.  TRULY!  Then we were on to butter chicken (our FAVE!), dal makhani, sag paneer and onion kulcha.  IT WAS AWESOME!  We long ago found that the Bukahara restaurant we ate at in Dehli in 2000 and had AMAZING dal makhani is the same place where a chef at Kohrinoor works (ed).  It is the BEST since we left.  And tonight's dinner . . . . . AWESOME!  And soooo close to home!  We LUV this place and felt like Moghuls the whole time!  :-))))))

SHUKRIA BIG TIME!",Delicious food and super attentive and friendly staff! The vegetarian options are so good. We will definitely be back.,"I am going to preface this review by saying that I am giving this place 1 star only because the chef actually came out and asked me what was wrong with his food. Otherwise I would give it -1 star. LOL.

I feel for anyone starting a new restaurant, its a lot of work and so much learning to do, that being said.... if you don't know what your wait time is when someone comes and asks you how long is the wait for a table is then you have to learn HOW to run a restaurant before you open one.

Our experience was some what of a funny dream, here is how it went. We walked up to the hostess who had a nice smile on her face and said ""table for 2 please"". She goes ""nothing is available except this one table (which was right in front of the door)"" so I say ""I don't want to sit here and don't mind waiting, how long is your wait"".  She says "" I don't know, it could be anything""... I could not believe what I was hearing LOL. Then she goes ""I have to write your name down"" (like it was very depressing that she had to do that), I said ""sure go for it"". She adds ""It will be at least 35 minutes"" , I am like ""thats fine, thank you"". Then 4 minutes later she goes ""The table is ready!"" LOL.

Anyway I thought that was mildly amusing and said as long as the food is good who cares, I can always do take out from here. Then 20 minutes pass and no one comes to take our order. So my poor husband had to go ask the hostess again to come over,  I said ""Is anyone going to come take our order"", She goes ""No one came to take your order yet? Its been so long no?"" I am like in my mind of course (DUH!!!). 

The she drags the waitress to our table and says ""Here she is!"". Our waitress looked so depressed, didn't smile, didn't introduce herself, just took down our order down and left. She did say ""sorry about the wait"" which was nice. 

The food then arrived.. rather quickly.... so we thought its looking better now.... maybe this is a positive sign. BOY were we wrong... the Sheesh kebab was totally without any flavor... but edible so we said, maybe this is not their signature dish. Lets order something that was highly rated like the lamb vindaloo. Omg... the vindaloo was horrible, I refused to eat it, the spices were not roasted so the raw smell was all over, it was horrendous. 

The only items that were edible were: rice, the roti and chicken malai kebab. Notice I said edible! Then in the end we just wanted to get out of the place so we struggled to get someone to get our check since no one had come to our table to fill our drinks or even to ask how we were doing. Again my poor husband reluctantly went and got the hostess since our waitress was no where to be found.

When the hostess noticed we are not packing anything and didnt eat anything she said ""you didnt like it?"".. I said it was alright trying to be polite.. but she asked again and I said .. it was not good.

Then out comes the chef asking me what was wrong, and since he asked, I told him politely the spices were not roasted. To which he goes,  I am the chef, I think you are reacting to the vinegar and started telling me how long it takes to cook lamb and that he will give a tour of the kitchen. I told him listen I am Indian and I cook everyday the same thing and I know what was wrong. To which he goes what did you order LOL... if he didn't realize by now what we were talking about, I knew that was trouble. He then went away and came back and said ""I tasted it and I talked to the other chef that prepared your meal and he confessed that he had not roasted the spices. If it was me I would have roasted the spices, but my other chef admitted he didnt do it"". Then he asks me again"" What did you order?"" LOL LOL LOL..If he tasted it and could not tell what it was ... we got some serious problems!!!  I then said ""thanks for taking it off our check."" This is why I give them 1 star... but overall food was totally not what Indian food should taste like. If you want to taste good Indian food please go to memories of India 2 in lake mary to get an idea of what service and Indian food should taste like.. then go back here and you will notice the difference.

I also have to add that as we were going through our somewhat alice in wonderland type experience other tables were complaining that no one had come taken their order in 40 minutes. 

Again, I feel for anyone starting a new restaurant, lot of kinks to work out. But if you don't roast your spices, and can't recognize your food by tasting it, and don't know your wait times... you should re-consider your line of business and at least try to hire someone that can help you understand the basics.  I will definitely NOT go here again and in fact this restaurant inspired me to join Yelp and let people know that this is NOT good Indian food, and lets not even go into the ""FINE"" in their name. Thank you for reading.","One of the worst Indian restaurants I've ever been to. The food was so bland, very few options at the buffet and service was terrible. We asked for a bowl and they told us to fill 5 tiny sauce cups. Seriously?! Horrible, insulting service.","Would have given this place a 4 or 5 before tonight,but their total lack of customer service clinched the deal. I WILL NEVER STEP FOOT IN THIS PLACE EVER AGAIN. Ordered the lamb kabob it it was so tough I could not eat it. Three different people came to my table and asked how is the food or do you need a to go box. My answer each time was no this food is too tough to eat. All I got was three blank stares.
   I work in a service industry job and I know sometimes you can screw up,but just make it right. They should have asked if we could have switched it for something else,cook another dish. They don't care so I will take my business some where else.",290,1
Nine Spices Hot Pot,5320 S Kirkman Rd,4.0,Restaurant is very clean. Good variety of food to chose from for the all you can eat. Excellent service!,"Soooo good, fresh and very healthy. I come here every time I'm in town. love this place.","So so so good. Was my niece's first hotpot experience and it was definitely a success. The soup bases are delicious, we were a party of 3 so we got the original, herb,
and bone. Herb was my favorite but all three were delicious. The meats fish and seafood are so fresh, veggies are crisp, and so many types of noodles to choose from. Also anything that we couldn't see on the conveyor belt was promptly brought by our lovely server. $25 a person for such a high quality all you can eat is a steal in my book. 
Can't wait to be back in Orlando to come back here.",Food was not fresh. Serve was nearly nonexistent. Asked for clams and did not receive it during the entire visit. Server did not visit our table even once.,"So. When the staff can't identify what is in your bowl, that's a good indication you should not put it into your body. 

Made that mistake. The squid balls came back violently. 

#foodpoisoning","Don't eat things the wait staff can't even identify off the conveyor belt. Should have been a no brainer on my end to avoid food poisoning, but alas here we are. 

Stick to beef or just don't eat here.",506,1
Oreganatta,6320 International Dr,2.5,"This place is amazing. They make you whatever pasta you want and pizza customized. Carlos the manager and the lady making the pizzas were great ! Really good costumer service and the food is real Italian food which I did not expect , it was very tasty. Also they have beer and wine for sale which is lovely you can drink wine with your pasta. And the dessert is amazing. Very good over all I will def  be coming back here. Also they play good
Music, really good atmosphere. Also the tomato soup is amazing. I loved it all","Pizza Delivery...amazing!  I have never been to the location, but have ordered their pepperoni pizza 3 times for delivery, and it is exceptional.

I would call it close to New York style, thinner crust, and definitely a lot of garlic going on.  Absolutely terrific pepperoni pizza.

I'm very surprised to see all the bad reviews, most are regarding the location, or the pasta or salad bar prices.  My suggestion:  stick to the pizza and I expect you'll be pleased!","I don't really know about giving 5 stars because I'm afraid I'll discredit a 5 star rating in the future... but sincerely, this place was amazing and we just happened to stumble into it.  It's not huge and it doesn't need to be. It's clean inside and the service is better than most of the other places in the area. The salad bar selection was good. Two soups were offered tonight, minestrone and lasagna soup. I didn't try the lasagna soup but I did try the minestrone and it was great! The pasta is worth the wait, lemme tell you. It's buffet style but made-to-order. Also, the desserts are super cute and my daughter and I had to try them all. Oh! And beware of the cinnamon rolls!! They're deadly delicious!","Did deserve the one star, my family and I came here we didn't enjoy it at all. Go Cici pizza or stay  home and cook.","Tourist trap coffee tasted like water,  only choice of meat was chicken,  soups were tasteless.  Even the cheesy bread had no cheese.  All drinks were  $2.60 even water.  4 noodle choices and 4 sauce choices.  My son thought they had little cups of ghellato, turns out it's just whipped topping with flavorings on top.","Not as advertised. Waste of money. So bad we left hungry and had to go somewhere else to eat. Only 2 types of pizza. Cheese & pepperoni, very bland. Some salad toppings with stale croutons. Pasta with watery sauce and chewy dark meat chicken.",76,1
Phil-Asian Foodmart,2650 N Orange Blossom Trl,4.5,Went here on a weekend and they have a buffet food and pastries are very good. Theyre very helpful and friendly too.,Love this place! Feels like you are eating at a friend's house. The owner was so nice and accommodating. They serve buffet on the weekend. Price was very reasonable. Can't wait to visit again when I am back in Orlando.,"Excellent chicken adobo, the rice awesome. The place is nice and friendly. I can't wait to go there for there pancit.","Hard to find Filipino's places around Orlando for breakfast. This was the only one that had prepared hots foods to order.

We loved the sweet chicken with the garlic rice. The sinigang with pork wasn't that flavorful and the pork was really dried out and chewy. The milk fish tasted old and the longnise was so so.

The staff was very friendly and fun to be with.","Serving food everyday from breakfast to dinner. Buffet on weekends. Balik-bayan boxes, phone cards, money remittance, filipino groceries and more! Good costumer service. Parking sometimes can be a hassle specially during lunch time this place can get very busy so plan of arriving before rush hours.","Pandesal is thumbs up!!! 

Stopped off here for Filipino Breakfast, I had tapsilog (beef tapa, egg, rice, & tomato) - - it was good, but only one egg & the tapa was frozen.  Up north they normally give two eggs, not one - - but that's ok.  My wife had fish which enjoyed.

We also tried their Pandesal (Filipino roll) & it was very good - - we even took 3 bags home to Connecticut with us.

There are only a few seats (about 12).  Dinner does get crowded, mostly take out.

They have a little market - - I mean little.

Enjoy!!!",14,1
Plaza Garden Restaurant,9000 International Dr,3.5,"We stayed at Rosen Inn and had both breakfast buffet and dinner buffet at Plaza Garden Restaurant. Both were very good. Food was fresh, hot, well seasoned, and delicious. It was more than expected from a restaurant inside an inn. $9 for breakfast and $15  for lunch, it's a good choice for some lazy last day staying at the inn. Plus the service was excellent too.","Regular buffet.. the usual choices, toast, eggs, bacon, pancake etc.. Service was fine not much was needed since it's a buffet. Great breakfast deal for kids under 9 to eat free with adult buffet purchase. I ate and my kid stuffed his face for just $9 not including tip and taxes!! May go back for lunch or dinner!!","A really good amount of choices at the breakfast and dinner buffet! Clean and friendly, reasonably priced too! Different daily choices keep it fresh! We eat here often even in this area crowded with restaurants!","Horrible food. Dry turkey, dry pork, flavorless sides. Terrible service. Don't spend your money. There are better places to go.","I wanted to wait until I had the breakfast buffet before I wrote anything. I had the dinner last night and wasn't impressed but breakfast was much better. Night and day different.
The dinner has a a pretty good selection of eats but most were overcooked. The pork loin..dry. The Beef Stroganoff (if that's what it was, was overcooked..the mixed veggies, same story. I didn't even try the fish. They DO have a senior discount for over 55 so the meal was $11. The servers are quite nice, very accommodating.
Same for the breakfast crew. And the breakfast was a marked improvement. The pancakes were good, sausage and bacon pretty good, they had yogurt, cereals, grits, etal. And the coffee was quite strong.
But they don't have a senior rate for breakfast. Even so, it was $9 with tax. I feel good now, ready to go walking a few miles now.","Regular buffet.. the usual choices, toast, eggs, bacon, pancake etc.. Service was fine not much was needed since it's a buffet. Great breakfast deal for kids under 9 to eat free with adult buffet purchase. I ate and my kid stuffed his face for just $9 not including tip and taxes!! May go back for lunch or dinner!!",6,1
Ponderosa Steakhouse,7598 W Irlo Bronson Memorial Hwy,3.5,Absolutely Perfect. Food was excellent service even better. Couldn't ask for a better establishment.  If there was an option for 10 stars I would give it.,"Was very pleasantly surprised by the service, steak, and buffet!! I hadn't been to a ponderosa in years (since there aren't many left) but honestly this is probably the best one I have ever been too! The steak was cooked just as I ordered and it tasted so good that it did not need steak sauce!! The buffet had plenty of items and a well stocked salad bar. Everything was very fresh!! We had a couple of servers check up on us multiple times and they made for a very great experience!! We are passholders to universal so we will definitely be back!!","Wow! Great inexpensive food and super clean.  For 45 minutes we were the only people in the restaurant.  This is the ONLY Ponderosa in the State of Florida... had to stop in.  Everyone was super nice and helpful.  There is ""enough"" of a selection of food to have a decent meal.  Salad bar and hot bar was fresh, neat and clean.  I'll be heading back.","I sat down with my daughter after getting a plate from the buffet and we started eating by then my steak arrived, when a man behind my table tells me and points out the big size cockroach walking down the wall straight to my table. He tells the waiter and the waiter grabbed a napkin and kills it right in front of me. Needless to say I was grossed out and lost my appetite. I saw the manager avoiding the situation and he did not came to the table to apologize for the situation until after like 10 minutes, he said sorry that was it. I was in shock on how they handled everything like nothing happened. I was the one who asked for a refund because I was not eating  anything else from that restaurant. When they came back with my receipt they only refunded my plate not the whole check. I've never been grossed out by any restaurant until now. I am very angry and disappointed on how they treated me.","Horrible buffet.  Dry chicken, dry hard meat loaf, ice cold pasta with sauce that tasted like canned tomato paste. Yuck!","First off, I give it zero stars. This automated system forces you to give it a star rating before one can proceed. The worst dinner we ever had. The staff dressed in poor attire. Kids were running all around the place, like it was a playground.  The food was terrible. The hot items on the buffet bar were cold. The steak was salted down. The lighting in the place was awful and it could use a paintjob.",21,1
Rosen Inn Lake Buena Vista,8442 Palm Pkwy,2.5,"We seriously only paid $52/night, thanksgiving week for a clean, spacious,  and recently remodeled room, 15 minutes from Disney. The staff were all friendly and helpful. For what we paid, we really lucked out. I was a little worried, but very happy (and surprised) by this hotel. If the weather would've been warmer, we could've taken advantage of the little water park area, which also looked nice for the kids.","Excellent hotel for the price! Room was clean and smelled fresh. I did not use pool, no gym that I know of, and buffet didn't look fresh, but I wasn't there during the busy season. These are the only downsides that I noticed but was overall a great place to stay and I would highly recommend! I liked that the location was gated and had a gate attendant at all hours, it felt very safe.","Perfect hotel if you are just going to the parks and needing a place to crash. Clean , comfortable. We have kids and it was perfect. Wifi is slow but we all need to disconnect anyway.  Family vacation means spending time with one another not surfing the net.","There was more than one issue that has made our stay here very frustrating. We were visiting from Las Vegas on our honeymoon and decided upon this hotel for many reasons, one in particular, is that it was a WDW good neighbor hotel. With that being said, we think that the customer service should be held to a higher standard, and this hotel lacks any type of customer service. I have received better customer service in a motel 6! We called on a Sunday the 10th of November to see if we would be able to check in early. They said, no problem, just call in the morning to see if your room is ready. Monday the 11th we had called, and asked if we could check in early, especially since we are traveling with a pet. They said, no problem, your room is ready. We get to the hotel, the front desk staff was very unfriendly. We were not even greeted with a simple hello. Then they go on to inform me that the room was not available. I explain that I had already spoken to someone and they said it was. She said, that since we were traveling with a pet, they had to put us in a different building and no rooms were ready yet. I was not going to accept this for a solution. What were we supposed to do, sit in the lobby for 3 hours until the 4 pm check in time! Then she goes in the back, talks to someone and miraculously a room is all of a sudden available. This has set our tone for what is supposed to be a happy vacation off to a very sour note. The next day I go to the front desk to pick up our breakfast vouchers since they said they were not ready yesterday and ask for a new room key since I had left mine in the room. I give them my I.D. they make me a new card. I go all the way back to the hotel room, and THE KEY DOES NOT WORK! Now I am beyond frustrated and I am furious! I walk all the way back to the front desk, tell them my key does not work, and they say they can't give me a new card with out my I.D. (which I left in the car) and they saw me less than five minutes ago! At this time I ask to speak with a manager. They go to get her, I am waiting for over five minutes and she is still a no show. At this point, I am just so frustrated and want to get on with my day. This will be the last time I will ever stay at this hotel.  Hopefully my review will help others from making the mistake that I did and book this hotel.","Upon arriving to our room (1331), I turned on the lamp and my 3 year old son immediately pointed out ants on the desk. I was surprised to see about 25 ants crawling all over the desk and part of the dresser. Since they were small black ants, we just got rid of them and made sure there weren't any on the beds.
Later that night, I found 16 black pubic hairs on the  rim of the tub and inside the bath tub. I moved the bath mat to the side to get it out of the way and there were 3-4 more hairs underneath that. ABSOLUTELY DISGUSTING!!!!!!!!!! I ran the shower for 10 mins just trying to get all the hairs out of the tub. I immediately felt like that room had not been cleaned. I called front desk to verify and explained what I just saw and the only thing she told me, ""Yes, of course it's been cleaned.""  That's it. She had no explanation for the pubic hairs nor did she offer some comfort or even a different room.  
It was hard to sleep peacefully in that room the next 2 days since I felt like maybe there were other disgusting things that have yet to be discovered. This is not a quality hotel. 
The front desk & housekeeping need better training... also room 1331 should be sprayed with insecticide.","My fiance and I stayed here for race weekend and expected it to be not high quality and even expected the room to look old etc.  We were not even surprised when we saw the shower with dirt and hair in it.  (i cleaned before showering).   I just laughed it off an said to myself ok next time I will pay the extra to get a nicer hotel.  

What did shock me was the following.  I was checked in and prepaid until Monday.  My IPAD was taken from the room.  When I called security they said they did not have it and was questioned if I even brought one.  It wasn't until I called the police and told them about the tracking information on it that it was magically found.  I got the craziest run around by Security for an explanation and was never contacted the following day.  The services was DISGUSTING to say the least.  We received 3 different stories on how my IPAD from the room I was checked into ended up across property in the security office.  I called the GM after returning home to tell her what had happened and she promised to call me back. I told her I really did not want to speak to security again since my issue was with them. The GM set a poor example because she had security call me back at 10 something at night to my home number.  The GM nor the Deputy never called me to follow up like promised.  I guess it was too much for me to expect a level of costumer service from upper management.

Hotel is a disgrace.  (Please note the check in staff was very friendly).",145,1
