id,address,rating,good_one,good_two,good_three,bad_one,bad_two,bad_three,size,groupid
Golden Corral Buffet & Grill 6,11701 International Dr,3.5,"This place is really clean. The staff are pleasant and friendly. Our waiter while not chatty, was attentive and frequently made sure we were ok. A fabulous variety of really fresh, delicious food. From salads with house made dressings to grilled steak done to your liking. The desert bar is varied and delicious. The chocolate fountain was well maintained and had a great choice of things to smother from fruit to marshmallows. There is a constant bustle in the kitchen and food is changed with frequency. 
The bathrooms, while a little small, were clean and smelled that way. 
The staff obviously takes pride in their location and it shows. Would come back and would defiantly recommend. The price was about $70 for 3 adults with drinks and 2 children. We all left very satisfied with the kids asking ""when are we coming back?"".","The best Golden Corral in Orlando. manager is on top of it checking his employees, the food and patrons  this is not even in the same category as the other ones. Corporate needs to take notes from this one

Third visit as it is a easy meal with children
The place still tops in this category and even surpassed its last recommendation. The steak and shrimp was excellent. And again, the assistant manager was all over the place where needed.  As cashier, ensuring guests were happy, clearing tables and keeping the hard working staff upbeat","We were taken here by some relatives since we are in town and don't get to see them too often. When I heard they were taking us to Golden Corral, I didn't know what to really expect. I've never been to one although I have seen commercials and it just looks average. Needless to say I was very very wrong. Unsure if it's just this location based upon other reviews, but this place was all around great. Our waiter was so nice and extremely accommodating. He made sure we were all set and always came back to ask if we needed anything else. Now onto the food, it's everything you could ask for and more. Any craving? It's probably there. The pulled pork, steak, fried chicken and yeast rolls were stand outs to me. I also loved that they had a salad bar as it gives you another alternative if you're not feeling too gluttonous. I noticed a majority of the food was fresh and if it was standing there for a while they replaced it. The dessert bar was ridiculous! So much ice cream, cakes and even a chocolate fountain. My cousin is an ice cream fanatic and even asked me if this is heaven..","I went to this location yesterday and was beyond disappointed and quite frankly deserved to get my money back. 

When we walked in every available table was dirty with the prior occupants feed and dishes. When we asked one of the waiters to clean a table off for us . He just stood there and stared at us. Very rude! It took us asking 2 waiters before getting help.

When I went to get a plate it was dirty! Had mashed potatoes all over it and a few plates under it. I thought they washed these things. The floor had food all over it. I just couldn't bring myself to eat much of anything there.

I tried some fried fish and veggies. That wasn't even good. I will never go to any Golden Corral... Ever!","overly disgusted with this place which is down the block from universal studios.  it was dirty, understaffed and it smelled really bad.",Went in for carry out and they told me one price at the register and when i came back to pay they raised the price on me.,116,1
Golden Corral Buffet & Grill 7,2701 W Vine St,3.5,"I've never had a problem here. They cook the beef to the way you prefer it be cooked, (well, medium-rare, etc). The food never runs out, they promptly refill food that is running low. They are so friendly! I've been to bad Golden Corral's, and this one is top-notch. But know - it's not fine dining - it's a buffet! It's probably the best buffet I've ever been to.","Five stars for the management and wait staff. The food was good, but the waiters and managers were patient and gave great service.","Certainement mon enseigne buffet préférée, ce restaurant comme celui d'international drive est propre et spacieux.
Bon il est certain que je ne vais pas dans un Golden Corral pour manger de la grande cuisine, ce ne sera jamais un cinq étoiles, mais les plats sont variés, pas top mal cuisinés et il y en a pour tout les goûts, viandes, poissons, pizzas, pâtes, salades etc...
Autant dire que si vous mangez comme un ogre c'est votre enseigne, si vous voulez manger plus léger ou vous gaver de protéines vous pouvez aussi.

Le buffet de desserts est lui aussi très variés, mais le meilleur étant le banana pudding, un vrai régal et la aussi accompagné de glace miam!!",How very disappointing my busyness is food no flavor the only thing that tasted good was the yams with marshmallow the people that work there they don't have a clue of what they going,"If I can give you guys less .1/3 star I will. The place nasty, un sanitized, un clean and so disorganize.. we will not comeback at all.. ever.. please, hired more people, make sure you have enough servers...  I didn't see the manager.. that how poor is that place.. we pay to much for so poor unclean place.. can't believe it!!!!!","DON'T do it! It smells like mildew, there was used gum wrapped up in the silverware packet, hair in the food.....",54,1
Golden Corral Buffet & Grill 8,8032 International Drive,2.5,"Have been to several. Despite the afternoon crowd picking up, they were right on point. To sum up the service, staff and food only needs one word....AWESOME! The experience was Greatly appreciated!",Cleanest Golden Corral I have been to everyone was very friendly lady cleaning tables kept our drinks full and table clean I will eat there again when I'm in Orlando,"We eat occasionally at the Ponderosa, but heard quite a bit about Golden Coral, so thought it was definitely worth trying out.


 We were very impressed with the variety, quality, and quantity of food available.


 There were steaks, chicken, pizza, fries, baked potatoes, roast potatoes, pot roast, fish, soap, as well as a wide variety of cakes, gateauxs, ice cream, muffins - actually, anything you can think of !


 Since eating out at Golden Coral, we will certainly be giving Ponderosa a miss, and coming back here next time we stay in Orlando.",The worst food I ever eaten enen the salads were horrible soup nasty mac and cheese discussing also the ice cream was watered down I guess you get what you pay for 15 bucks down the drain,"JUST PLAIN TERRIBLE!!  To be fair, I hate buffets, but we were with a party of 14 people so I was outvoted. I just don't how to say this any simpler, but a customer actually deficated, YES A NUMBER 2, on the floor in the hallway towards the bathroom!!  Yuk!!! My wife was horrified and to boot, a member of our party unknowingly stepped in it!!  Can't make this stuff up!!  I can go on and on about how dirty and how disgusting the food was but I just don't have all day. Just do yourself a favor and avoid this place like the plague!!  I would give this place negative stars if it allowed me. Lol","I gave this restaurant one star because this app will not let me leave ZERO STARS. I'm not a fan of buffets to begin with but we had a large group of people with different dietary needs so this seemed to be the best solution. I can't remember when I've been to a nastier place to dine. Half of the ""stations"" were empty so there wasn't much selection. I will say that the lettuce was fresh so we had a lot of salad. No one ever came by to ask to refill our drinks. The worst, however, was as I headed to the restrooms I could smell ""waste"" very strongly. Turns out that someone had an accident right on the rug in the middle of the hallway in front of the bathroom doors!  But wait... That's not the worst of it. It was left there for so long that someone actually stepped in it by accident. It took this restaurant at least 15 minutes to address this issue and clean it up. I have never EVER encountered something so disgusting in a dining establishment. They have a huge plaque by the front door calling themselves a ""model restaurant""... Ha!!!",123,1
Golden Corral Buffet & Grill 9,897 West Town Parkway,2.5,"I came here with my family yesterday for thanksgiving, I didn't have time to prepare a dinner for my kids this year. While there I met a woman full of holiday cheer, I believe her Name was either Tangie or Tangela. She was so polite to me and my family she kept a huge smile the entire time she was helping everyone. I observed her while I was dinning and she was this way with every person she encountered. I am very thankful you guys hire people who actually care. I wanted to think her personally but being thanksgiving it was too busy and I did not get the chance too. So Thank You Tangie and Thank You Golden Corral for help out me and my family and treating us like family.","The  manager jim was very professional and kind. He fixed our problem and concerns and treated us to lunch the following day. This visit was much much better, cleaner and fresher food. I enjoyed the fresh baked turkey and fresh veggies. 

I say its a good clean buffet most the time, later at night it can get iffy and the staff slacks off on just about everything. But go for lunch or early dinner and its great, like a totally different place! 
I will probably not return for a long time only because I have to steer clear of buffets haha","We have gone to this Golden Corral over several years on occasion but recently we went back and what a change, in the past found it was too expensive for the quality but just visited again and was impressed by everything.  Already looking forward to eating there again. They have certainly improved and if it didn't have the name Golden Corral outside I would think the food was from a different restaurant. Maybe they have new management but everything was clean even the bathrooms. Also all the food was fresh and delicious. The service was very good regarding keeping the drinks filled and removing dirty plates. But the food was wonderful. We were at another Golden Corral recently and I had to spit out the sweet potatoes they were so bad among other things but at the Altamonte Golden Corral had to go back for seconds, they were so good. Interesting how the taste was so different, didn't make a lot of sense. The only small issue I had was the spoons in the salad dressing were a bit hard to read as to which salad dressing was which and the Blue Cheese was marked with another dressing but when I figured it out it was delicious like everything else. Now they need to get the other Golden Corrals to offer the same level of taste, service and cleanliness as this one in Altamonte, FL.","Used to be a great place to eat. Last few times there the food has been horrible. Both the food and the restaurant are dated and tired. 
Do not recommend! 
Went again. Should not have. The prime rib was tasteless and the shrimp were burnt! Will never, ever go back.","Used to be a great place to eat. Last few times there the food has been horrible. Both the food and the restaurant are dated and tired. 
Do not recommend!","I wish there was a star less than one. I guess I'll give that one star to the server that finally filled our drinks once. This place Is horrible. Filthy, loud and pourly run.  I mean I wasn't even expecting much and was still disappointed. After waiting for 11 minutes (yes I looked) I gave up waiting on the mac n cheese that the MANAGER promised would be out in 2 minutes when I first got up there, after that he just pretended he didn't see me. So they came out 19 minutes after I originally asked (I watched them finally bring them out so I went up). What another disappointment. Watery macaroni cheese soup. Sounds pretty great right? Apart from the whole uncooked chunks of potatoes in their mashed potatoes and the selection of steak temperatures ranging from well done to burnt as hell, I feel like I threw 30$ out the window. Do yourself a favor and just get some McDonalds, a definite upgrade.",64,1
Harvest Bistro,14100 Bonnet Creek Resort Ln,4.0,"Breakfast buffet was great( free for HH members ). Kids eat free, which is nice. 

Dinner was really good too! Pizza was homemade and delicious. Kids eat free for dinner too!","Food was good. Great selection. Jeffrey was the best waiter I've ever had!!!! His service is excellent, every time I needed something he was already getting it. He even recommended a bunch of places for us nearby too which was nice.",This is our favorite spot to grab dinner when we are staying across the street at the Wyndham Bonnet Creek.  Casual and delicious!  We love to sit outside on the patio and enjoy the breeze.  The cocktails are delish and every meal we've ever had is so yummy!  Our faves are the salmon and burger.  We also love to hit up the little store in the main lobby of the Hilton for dessert.,"Because there is nothing in close proximity we ventured here. Terrible service, sat us in a dark corner (when we complained we were sat in another slightly better dark corner). A la carte seems to be frowned upon as it is sold as ""well that will take longer"" and the omelet and scrambled eggs my husband and I had looked like they came straight from the buffet. I should have trusted yelp reviewers, don't make the same mistake we did. Just go to the patisserie on the lobby area for pastries you will be happier, trust me","I can't say about the food we didn't get that far walked in the hostes had her head buried in the newspaper walk right past her there was a second podium the person at that one was so cpnfused had no idea what to do with us so we just went and sat down,mind u this wasnt during a very busy time the reasturant only had a few tables .still no biggie now another person came over with a real attitude like we stole her firstborn she snatches one of the glasses and the extra napkin with the silverware no hi no menu only sttitude a waiter walked by and bumped my chaair kept on going no sorry no nothing might have been intentional or not cant say ,thats when I had to leave on the way out saw the woman who snatched the napkin with the silverware and glass guess she was a hostess that wasnt doing her job so she got upset we had sat ourselves, so we went back to the waldorf sat by the pool with great food and service from , taylor","Ordered 2 $15 burgers at 7:15pm, 1 Med-well, the other well...fast forward 7:55pm 2 burgers come...
1 medium the second (mine which should have been well) RARE!!! BLOOD EVERYWHERE! The bun soaked in dark red blood raw meat inside...
They brought me a second burger...faster, middle red inside again...I simply gave up.",84,1
Hokkaido Chinese & Japanese Buffet 1,5737 W Irlo Bronson Memorial Hwy,3.5,"Here in Florida on our Disney vacation. Decided we wanted some seafood but needed a break from Disney prices so decided to check this place out. The food was good, your typical Asian buffet fare with sushi, hibachi grill, and dim sum. But we were blown away by how cheap it was to eat here, especially when you're use to DC prices which are easily 2-3 times more expensive for the same or worse food!","Excellent place! My expectations were far exceeded. The price was very affordable at $12 and they had everything the expensive buffets feature. Clams, blue crab, several fresh kids of fish, a raw bar and huge sushi selection!!  Wow!!!","very good and save more when you use 20% off coupon on yelp.
The waiters are friendly and you should never miss it!","Well I must say my first time going wasn't a blast! Majority of the food was cold and our server just forgot about refilling our drinks.  But let me tell you about this one customer. So I'm scoping out the sushi which by the way wasn't all that good or fresh  but this little kid decide that he want to pick up a sushi from off the plate from the buffet, bites it and puts it back up there after saying he didn't like it.  So at that point I was heated and ready to go because that's was one of the nastiest thing i have witness in person take place in a restaurant.  He looked at me as he knew what he had done was wrong and the whole time I was giving him the ""you need your tail beat look"" for that! So if you go there best watch out for ""snackers"" at the buffet, that them ppl that eat while fixing there plates because sometime they grab from the buffet with there hands.. Also, the pictures that they have posted are deceiving, it looks nothing like that!!!",This is a worst place I have never been. All servers are talking while I ask for some helps. The host does not care about their customers even tho we are just standing in front of her. I would like to give 0 star if I can!,"Not good. Had high hopes considering the variety of food served, pics of nigiri, sashimi, and other fresh looking fare I saw on Yelp. Don't know what happened. Staff was nice and the restaurant looked good but the food just sucked. Nothing I tried was even remotely good. The ""sushi"" consisted of an assortment of rolls stuffed mostly with cream cheese and cucumber. Only fish in any of them was tasteless tuna. Even the soy sauce tasted cheap. All the hot stuff was awful from the pan fried dumplings that were in a steam pot so they were mush, to the classics like honey chicken and beef and broccoli. All chewy and old tasting. I thought maybe the hibachi would yield some fresh flavors. Wrong. I asked for the hibachi sauce but got a plate that, although it looked good, smelled like an old sock and had no flavor other than the off taste of butter or oil or whatever it is they squeeze on the grill before cooking your plate. I've been to dozens of these type places and can't say any have dissapointed to this level. Too bad.",401,1
Hokkaido Chinese & Japanese Buffet 2,12173 S Apopka Vineland Rd,3.0,"Found this new place by accidentally passing by! Me and my sister came by after shopping at the outlet that was literary less than 10 minutes drive away. We were welcome in by the manager and the host, inside is completely not what we were expecting, it was beautiful and take your breath away by amount of food! We had the Brunch, which is $10.99, it is worth every penny of it. I've been to many restaurant in Orlando, this is by far the best deal!
Hibachi was great, the selection of vegetable, seafood(shrimp, squid, fish), and meat are all good. But the the cut of steak they have is fantastic, very juicy & tasty! And instead of stir-fry the steak, they even grill it for you, so it lock all the flavor!! ( I had like 3 steaks :) ).
Sushi for brunch have decent amount of selection, mostly rolls, no nigiri, but are on point.
The cold bar have some fresh steam shrimp, crayfish and mussel, talking about getting your money worth it.
The hot bar is really on point, they have 3 row of hot bar, and have all the traditional buffet items like rice, noddle, chicken wing, all kind of soup, fried meat, steam fish, but also have many other items that catch my eye (large steam clam, mussel with black bean sauce, and more...).
And last but not least, they have tiny cake selection along with fruits and jelly. But I was too full already after two scope of cookie and cream ice cream.....oh yeah, they also have nice ice cream!! = tummy happy  

Overall, the food was great, the service was friendly, atmosphere is nice and quite, and decoration is pretty cool (they have this amazing drawing on the wall at left when you first enter). I really love the food and the experience. I head the dinner selection are even better, looking forward to go back and try it! I highly recommend everyone to go and walk out like me with happiness.",a huge selection of sushi and a great buffet. unbelievable price for the selection and quality. I was very satisfied and will be back.,"Just ate here with 3 friends. We were all quite happy. I don't know what folks expect when they go to an Asian food buffet, but this experience was nothing but positive. The food was the quality I would expect from a buffet of this nature; it wasn't dry or under cooked, and it tasted good! Their variety is impressive. The facility is clean. The wait staff is polite. The price is very reasonable. Those who have left a negative review here either have unreasonably high standards for a buffet restaurant, or they hit the place on a bad day. In any case, I highly recommend this restaurant if you know what to expect from an Asian food buffet, and if you don't, come here for a great first time experience.","Came in, a lady seated us but as I wanted to tell her that if we can sit at a booth, she left. So my little sister and I had to go and sit ourselves. We waited 6min. For the waiter to ask us what to drink. Still nothing, we just said whatever, let's go get food. First we looked around and then made a decision. Sat down and still no drinks or server. The party of 10 sat across from us and a waiter asked for drinks then came to us and finally asked. Pretty much 15min. Later. The mussels were good. My little sister loved the fries, but the dumplings had a weird texture. The food was okay. Nothing to brag about. I loved the oysters but because you can never go wrong with it. But do you wanna know the 2 worst things? The sweet tea was just water mixed with sugar. And the #1 disgusting food we'd ever tried was the strawberry mousse. It tasted like pepto Bismol. Hands down for real it tasted like it. My little sister and I almost threw up. Our faces were in need of help. We asked for the check. I had a 15% coupon but I don't think the amount was correct. But again, whatever to get us out of there. Left and decided to go to that pizza place next door.",Worst buffet.  Food was COLD. I would never go again.   The fruit was warm.  Nothing hat should have been hot was hot.  I was scared it would make me sick.,"The price was right, but as they say ""you get what you pay for""; the food was awful, some dishes looked down right scary and I've eaten at many Asian buffets. The tables and chairs were smeary wet where the waitress hurriedly sat us down under water dripping from a vent onto my shoulders. Oh, had to ask waitress several times to bring our drinks...service questionable",331,1
Hollywood & Vine,351 S Studio Dr,3.0,"This restaurant located in Hollywood Studios is casual with a large buffet. I found it to be very enjoyable due to the characters that were there and the staff. 

When I went up to the buffet I asked them what foods are gluten free and the chef took the time to walk down the entire buffet and point out what I could eat. I truly appreciated that because when I have even the smallest amount of wheat I can have digestive issues for weeks. Some restaurants just do not understand this issue.

I found the salad to be fresh and the potatoes well cooked. The roast beef was by far the best roast beef I have ever had. 

The dessert table had a ton of tiny delicious looking treats. I could only try a few that didn't have wheat in them, however I was able to make a small
Root beer float! 

Our waitress was very attentive. When she saw the characters coming around the room she encouraged us to wait to get our food until we got to meet them. I really appreciated that because this was the first character meal that I have ever taken my child to, and honestly I doubt we will go to another one due to cost. However - it was a really nice time. All the characters interacted with us and even hugged me! I was able to get multiple photos that we will cherish. 

I found the cost of this character buffet to be far less expensive than the ones at Magic Kingdom (about $30 less), so I was very glad to have found this location.

Thumbs up to this restaurant. It may not be upscale  but for us - it served its purpose of helping us to create memorable moments.",My favorite Disney breakfast buffet and character meet and greet! Their cheesy grits hit the spot on a cold November morning! They even have an omelette station for the adults made to order! Best tip - be the first family in at 8 am for a special surprise!!!,"Being a cast member of WDW, I personally have always wanted to eat at Hollywood & Vine bc I love the characters there that they have for dinner; Mickey, Minnie, Donald, Daisy, and Goofy.

The food and dessert they offered I thought was amazing! I believe the offerings change ever so often but being an adventurous eater, it definitely satisfied my palette. My friend who is a pickier eater even thought it was delicious as well. 

The character interactions were awesome, but it also depends on your energy, they feed off of that. With the price being $50 per adult, it was definitely a little expensive but still so much fun!","Being season pass holders we have eaten many times at H&V.  Feels as if the service (no one smiles and feels like they care how your experience is) and the food have gone downhill -- def feels like a very expensive middle school lunch cafe line.  

You do get the characters so if that's your reason for your going - it's fine.","Extremely expensive, $50 per person for lunch, and the food was cold, the fish was not fresh, the macaroni and cheese was sticky, the salad was watery, and even the wine was bad. Never again!","We made reservations for 7, several minutes maths in advance. Show up 45 minutes early. Told we can't check in until 15 minutes before. So we wait. 

Check in and are promptly seated at a table for 6. Ask to be reseated. One hostess says we have to put a chair at the end. Another says we can move the table next to us over. Busboy tells us we can't move it over.  15 minutes in and still trying to get this resolved as our waitress tells us we can't as well. 

We've been coming here to this specific restaurant for about 8 years.  This visit it seems like customer service has gone way down.",287,1
